estacao;baia;posicao;lat;lon;riqueza_taxons;riqueza_sp_m2;temperatura_c;salinidade;pid_um;n_nh4_um;fisionomia;dominante_1;biomassa_1_g_m2;dominante_2;biomassa_2_g_m2;dominante_3;biomassa_3_g_m2;dominante_4;biomassa_4_g_m2;dominante_5;biomassa_5_g_m2;interpretacao
Ponta das Canas;Baia Norte;Insular;-27.393333;-48.433333;43;18.48;24.5;35;0.02;1.03;Banco de Sargassum associado a coralinaceas articuladas;Sargassum stenophyllum;969.57;Amphiroa beauvoisii;290.69;Sargassum brachygonia;215.68;Jania adhaerens;181.71;Arthrocardia sp.;122.80;Area externa/menos central, comunidade estruturada por algas perenes
Sambaqui;Baia Norte;Insular;-27.488333;-48.540000;35;NA;24.8;34;0.04;0.49;Banco misto com Sargassum, Hypnea e Gelidiopsis;Sargassum filipendula;453.40;Hypnea musciformis;259.31;Gelidiopsis variabilis;162.36;Sargassum vulgare;134.81;Gelidium crinale;115.87;Estacao intermediaria com forte biomassa de feoficeas e rodoficeas
Ponta do Coral;Baia Norte;Insular;-27.570000;-48.536667;19;8.00;26.0;36;0.00;2.25;Tapete algal em area central urbanizada;Gelidium crinale;569.19;Chondracanthus acicularis;176.99;Centroceras clavulatum;111.17;Gymnogongrus griffithsiae;75.58;Cladophora sp.;66.36;Sinal de simplificacao relativa e maior N-amoniacal
Saco dos Limoes;Baia Sul;Insular;-27.613333;-48.553333;15;NA;21.0;31;0.03;3.26;Comunidade oportunista/tapete algal;Enteromorpha flexuosa;282.75;Bostrychia radicans;99.51;Ulva lactuca;71.64;Gelidiella trinitatensis;53.53;NA;NA;Maior N-amoniacal entre os seis pontos, forte sinal de eutrofizacao
Ribeirao da Ilha;Baia Sul;Insular;-27.731667;-48.565000;69;NA;19.0;32;0.06;0.83;Comunidade diversa com rodoficeas e tapete misto;Gelidiopsis variabilis;86.26;Spyridia filamentosa;62.09;Centroceras clavulatum;54.87;Herposiphonia secunda;52.34;Acanthophora spicifera;44.90;Maior riqueza taxonomica entre os seis locais
Caieira da Barra do Sul;Baia Sul;Insular;-27.813333;-48.561667;45;23.70;19.0;25;0.02;1.74;Comunidade com Sargassum, Codium e Hypnea;Sargassum stenophyllum;104.42;Codium decorticatum;86.23;Hypnea musciformis;65.45;NA;NA;NA;NA;Area sul insular rica, com baixa salinidade pontual no estudo
